{
  "schemaVersion": "1.0",
  "assetId": "junior-physics-answer",
  "version": "v8.23-derived",
  "sourceOfTruth": {
    "humanSpec": "../specs/compiled/试卷参考答案交付规范-初中物理-完整版-v8.23.md",
    "acceptanceChecklist": "./checklists/acceptance.md"
  },
  "kind": "subject-pack-runtime-config",
  "inherits": [
    "../platform-core/manifest.json"
  ],
  "snapshot": {
    "cachePath": "../../.snapshot-cache/resolved-snapshot.json"
  },
  "deliveryRules": {
    "finalDeliverables": [
      ".md",
      ".pdf"
    ],
    "forbiddenFinalArtifacts": [
      ".txt",
      ".zip",
      "image-answer-pages",
      "review-page-images"
    ],
    "cleanupAfterSuccessfulDeliver": true
  },
  "formatRules": {
    "choiceAnswerLine": {
      "required": true,
      "formatExample": "1—5：A、B、C、D、A",
      "answersPerLine": 5,
      "compactLayoutRequired": true
    },
    "questionLead": {
      "firstSubQuestionSameLineRequired": true
    },
    "figureBinding": {
      "requireQuestionFigureBinding": true,
      "forbidCrossFigureAnswering": true
    },
    "nonChoiceAnswer": {
      "classroomDisplayDefault": true,
      "avoidLectureStyle": true,
      "preferSinglePageWithinReadability": true,
      "preferStepwiseFundamentalFormula": true,
      "preferMoreDirectEquivalentPath": true,
      "allowNecessaryDerivationForDifficultSubQuestion": true,
      "requireUnitSubstitution": true,
      "dropUnusedOriginalFormulaHintLine": true,
      "preferMovePrimaryUnknownBeforeWrap": true
    },
    "math": {
      "trueLatexRenderingRequired": true,
      "displayMathLeftAligned": true
    },
    "instrumentReading": {
      "preferOriginalImageReading": true,
      "calculationOnlyForCrossCheck": true,
      "requireFigureBindingBeforeReading": true,
      "requireSecondaryRangeAndScaleCheck": true,
      "requireAnchorChain": true,
      "requireNeighborMajorTickCrossCheck": true,
      "requireTerminalRangeScaleEvidenceChain": true,
      "rejectContradictoryTerminalAndScaleClaims": true,
      "bindReadingToExplicitTargetFigure": true,
      "forbidCrossFigureTerminalImport": true,
      "triggerRecheckOnScaleDivisionDisagreement": true,
      "coveredInstrumentTypes": [
        "ammeter",
        "voltmeter",
        "ruler",
        "thermometer",
        "spring-scale",
        "measuring-cylinder",
        "balance-rider"
      ]
    },
    "experimentDesign": {
      "scoreSentenceStyleRequired": true
    }
  },
  "profiles": {
    "default": "classroom",
    "classroom": {
      "plainTextCjkTarget": 20,
      "plainTextCjkMax": 24
    },
    "compact": {
      "plainTextCjkTarget": 24,
      "plainTextCjkMax": 30
    }
  },
  "evaluation": {
    "dataset": "../../eval/junior-physics-answer/dataset.json",
    "casesDir": "../../eval/junior-physics-answer/cases",
    "visualBaselinesDir": "../../eval/junior-physics-answer/baselines/visual"
  }
}
